,ResponseId,UserLanguage,Cry_last,qual_Q,Trigger_cause,Trigger_cause_3_TEXT,Trigger_type,Trigger_type_4_TEXT,Context,context2,context3,intense_tear,intense_time,Zintense_tear,Zintense_time,mood_1,Freq,BACS_1,BACS_2,BACS_3,BACS_4,BACS_5,BACS_6,BACS_7,BACS_8,BACS_9,BACS_10,BACS_11,BACS_12,BACS_13,BACS_14,GES_1,GES_2,GES_3,GES_4,GES_5,TMF_1,TMF_2,TMF_3,TMF_4,TMF_5,TMF_6,ZGES_1,ZGES_2,ZGES_3,ZGES_4,ZGES_5,ZTMF_1,ZTMF_2,ZTMF_3,ZTMF_4,ZTMF_5,ZTMF_6,age,gender,gender_4_TEXT,live,live_6_TEXT,live_time,birth_other,BACS_Help,BACS_social,BACS_Ind,GRE,Cry_intensity,last.cry,known,helped
193,R_2fCm1XZA0g7uLIx,EN-GB,3,"I had a lot of assignments last week, but I didn' t have a lot of time. I had been working for hours and still wasn't done. At that moment I felt a lot of stress and started crying. I felt disappointed in myself. In my opinion I could do better. At such moments I always think about my grandpa who passed away a few years ago. I want to make him proud, because he always was so proud of me and my achievements. But thinking about him also causes me to miss him even more. Luckily my boyfriend came to help me. He calmed me down by saying he is so proud of me and that he is sure that my grandpa is too. After that I felt a little better.",3,stress and missing a person,1,,2,1,4,3,1,0.332559879,-0.73869892,3,2,4,4,1,4,2,2,2,2,4,4,4,1,1,4,3,4,4,3,4,7,7,6,6,7,7,-0.251067568,0.980019119,0.55861097,-0.394937304,1.391877796,1.731087344,1.663222259,1.261499957,1.262939687,1.955575676,1.31446663,18,2,,3,,1,,3.714285714,1.75,2,1.043026779,-0.203069521,2,1,1
194,R_1LwgYugSzgVBCka,EN-GB,3,I find giving presentations really scary and I was practicing with my mother and all went wrong and I started crying. My mother comforted me and helped me with learning the sentences by heart. After this I felt much better and had confidence I could do my presentation the next day.,3,Frustration because of something I was bad at,2,,2,1,4,5,1,2.084630508,-0.73869892,2,2,5,4,2,3,5,5,4,4,4,2,5,4,2,4,3,2,4,2,2,5,5,5,5,5,5,-0.251067568,-1.674941768,0.55861097,-1.722282979,-0.617737195,0.4957901,0.511060475,0.627886187,0.596848136,0.616119595,0.333042471,18,2,,3,,1,,4,4.5,2.333333333,-0.047879234,0.672965794,2,1,1
195,R_UmX0ASW61nAl1e1,NL,3,"Het was tijdens autorijden, waarbij ik me bevond in een stressvolle situatie. Mijn vader zat naast me en had geen begrip voor waarom ik moeite had met de situatie oplossen. Achteraf moest ik daarom huilen. 
In de afgelopen maand heb ik ook een aantal keer gehuild omdat de gezondheid van mijn kat steeds verder achteruit gaat.",1,,2,,3,1,4,3,1,0.332559879,-0.73869892,5,4,4,2,3,4,5,5,4,5,3,4,4,3,2,2,4,4,4,4,4,6,6,6,4,5,6,1.14149975,0.980019119,0.55861097,0.932408372,1.391877796,1.113438722,1.087141367,1.261499957,-0.069243416,0.616119595,0.823754551,18,2,,3,,1,,3.285714286,4.5,3,0.894284253,-0.203069521,2,1,1
196,R_A6e6G2OIJSVHy4F,NL,4,Stress en missen van familie,1,,1,,1,1,4,1,1,-1.41951075,-0.73869892,2,4,4,2,1,4,4,4,4,4,4,4,4,1,1,4,4,4,4,4,2,5,5,5,4,4,6,1.14149975,0.980019119,0.55861097,0.932408372,-0.617737195,0.4957901,0.511060475,0.627886187,-0.069243416,-0.053608445,0.823754551,18,2,,3,,1,,3.714285714,3.25,2,0.484585497,-1.079104835,2,1,1
197,R_8jGHwB5SAyE7D7b,NL,4,Ik moest huilen omdat ik na lange tijd weer met m'n vriend had afgesproken (langeafstandsrelatie) en hij het niet zo naar z'n zin had. Dat deed me toen wel pijn. Ik was gewoon thuis en hij troostte me wel achteraf en daarna was alles ook gewoon weer goed.,1,,1,,2,1,4,4,2,1.208595193,-0.02089899,3,0,4,4,2,5,4,4,4,5,5,4,5,3,1,4,4,3,4,3,4,6,6,6,4,5,6,1.14149975,-0.347461324,0.55861097,-0.394937304,1.391877796,1.113438722,1.087141367,1.261499957,-0.069243416,0.616119595,0.823754551,18,2,,3,,1,,4.285714286,4,2.666666667,0.652936424,0.593848101,2,1,1
198,R_1Igw63idD0U7kBT,NL,2,Er was iets vervelends gebeurd en dat vertelde ik aan mijn moeder. Daarbij moest ik huilen en toen heeft ze me getroost. Hierna voelde ik me beter omdat ik het verteld had.,1,,2,,2,1,4,2,2,-0.543475436,-0.02089899,2,5,4,4,3,3,2,4,4,2,4,3,4,3,3,3,4,4,4,4,1,6,6,6,6,6,7,1.14149975,0.980019119,0.55861097,0.932408372,-1.62254469,1.113438722,1.087141367,1.261499957,1.262939687,1.285847635,1.31446663,18,2,,3,,1,,3.714285714,2.75,3,0.846847956,-0.282187213,1,1,1
199,R_10CbLRETpK1Gfyf,NL,3,,1,,2,,3,1,4,1,2,-1.41951075,-0.02089899,2,0,4,4,3,2,2,2,3,4,3,2,4,2,3,2,3,4,3,4,4,4,3,3,4,4,5,-0.251067568,0.980019119,-1.311794299,0.932408372,1.391877796,-0.121858522,-0.641101309,-0.639341352,-0.069243416,-0.053608445,0.333042471,18,2,,3,,10,duitsland,3.142857143,2.5,2.666666667,0.04993935,-0.72020487,2,1,1
200,R_7QHxIcDe9iHJQ9r,NL,1,"Ik droomde dat ik mijn vriend kwijt was, en toen die ochtend riep ik de naam van zn hond en las hij me de les dat ik dat niet moest doen als ze in dr hok zat. Dus toen moest ik even huilen.",1,,1,,1,1,2,2,1,-0.543475436,-0.73869892,2,21,4,2,3,3,4,4,5,3,4,4,4,4,2,4,3,2,3,2,3,6,6,4,5,5,5,-0.251067568,-1.674941768,-1.311794299,-1.722282979,0.3870703,1.113438722,1.087141367,-0.005727582,0.596848136,0.616119595,0.333042471,18,2,,3,,1,,3.857142857,3.75,2.666666667,-0.075650328,-0.641087178,1,1,1
201,R_12sV5Di5Yc0EJRD,NL,3,"De aanleiding was een discussie met mijn ouders. Ze geloofden me niet en waren boos op me voor iets dat ik niet had gedaan. Op dat moment voelde ik me machteloos. Hiervoor voelde ik me prima, maar erna voelde ik me verschrikkelijk. Ik heb toen gebeld met een van mijn beste vriendinnen.",1,,2,,3,3,4,2,2,-0.543475436,-0.02089899,3,1,4,2,2,2,5,2,4,5,1,2,4,2,2,4,4,4,4,4,4,5,5,5,5,5,5,1.14149975,0.980019119,0.55861097,0.932408372,1.391877796,0.4957901,0.511060475,0.627886187,0.596848136,0.616119595,0.333042471,18,2,,3,,1,,3,3.5,2,0.744105725,-0.282187213,2,1,0
202,R_1pKy817AMVjy6iK,NL,2,"Ik was gestrest om school, mijn vriend heeft mij getroost",1,,1,,2,1,4,3,2,0.332559879,-0.02089899,3,5,4,4,2,2,5,4,4,5,4,4,4,2,1,2,4,4,4,3,2,6,6,5,5,5,6,1.14149975,0.980019119,0.55861097,-0.394937304,-0.617737195,1.113438722,1.087141367,0.627886187,0.596848136,0.616119595,0.823754551,18,2,,3,,1,,3.714285714,4,1.666666667,0.593876718,0.155830444,1,1,1
203,R_2qagDKuUkRCvdGU,NL,3,"Ik deed iets fout en werd meteen boos op gereageerd, terwijl iemand anders precies dezelfde fout maakte en niets op werd gezegd",1,,2,,5,1,4,2,1,-0.543475436,-0.73869892,4,5,2,2,3,3,4,4,3,4,1,2,4,2,2,3,4,4,4,4,3,5,6,2,4,5,6,1.14149975,0.980019119,0.55861097,0.932408372,0.3870703,0.4957901,1.087141367,-1.272955121,-0.069243416,0.616119595,0.823754551,18,2,,3,,1,,2.428571429,3.5,2.666666667,0.516383235,-0.641087178,2,1,1
204,R_3CBLOHGFSl7z3j2,NL,2,,1,,2,,2,1,4,1,1,-1.41951075,-0.73869892,2,3,5,2,2,4,4,5,1,5,4,3,4,2,3,3,4,4,4,4,2,7,7,6,7,7,7,1.14149975,0.980019119,0.55861097,0.932408372,-0.617737195,1.731087344,1.663222259,1.261499957,1.929031239,1.955575676,1.31446663,18,2,,3,,1,,3.142857143,4,3,1.168153102,-1.079104835,1,1,1
205,R_2Xj0CLLIg3InCQc,NL,4,De aanleiding dat ik moest huilen was dat het uit ging met mijn vriend. Ik was thuis en voelde me erg verdrietig en begreep er niks van. Mijn ouders en zus probeerde mij te troosten.,1,,1,,2,1,4,4,3,1.208595193,0.69690094,3,0,4,4,1,5,5,5,2,5,3,4,4,5,1,4,4,4,4,4,3,6,7,7,6,6,7,1.14149975,0.980019119,0.55861097,0.932408372,0.3870703,1.113438722,1.663222259,1.895113727,1.262939687,1.285847635,1.31446663,18,2,,3,,1,,3.571428571,5,2.333333333,1.13951247,0.952748067,2,1,1
206,R_1KxMxM2F1nAGoBh,NL,3,Mijn broertje bleef maar doorgaan met treiteren en me opjagen. Hij wilde maar niet luisteren naar mij waarbij ik aangaf dat ik graag had dat hij stopte. Op een gegeven moment maakte mij dit zo boos en verdrietig dat ik moest huilen.,1,,3,,3,1,4,5,1,2.084630508,-0.73869892,3,1,4,4,3,4,5,5,2,5,2,2,2,2,3,3,4,4,4,4,3,6,6,7,6,6,7,1.14149975,0.980019119,0.55861097,0.932408372,0.3870703,1.113438722,1.087141367,1.895113727,1.262939687,1.285847635,1.31446663,18,2,,3,,1,,2.714285714,4.25,3.333333333,1.08714148,0.672965794,2,1,1
207,R_1ON42niyYVhHsIA,NL,3,Mijn kat is vorige week overleden. Hierdoor voelde ik me verdrietig. Mijn ouders ervoeren dezelfde emotie en steunden mij,1,,1,,3,1,2,3,5,0.332559879,2.132500801,2,4,2,2,2,4,5,4,2,4,2,2,4,2,3,2,4,4,4,2,3,4,5,7,5,4,7,1.14149975,0.980019119,0.55861097,-1.722282979,0.3870703,-0.121858522,0.511060475,1.895113727,0.596848136,-0.053608445,1.31446663,18,2,,3,,1,,2.285714286,3.75,3,0.498812651,1.23253034,2,1,1
208,R_2TnnIOYqYDOZgWU,NL,2,"stress en persoonlijke problemen
eerst heel slecht, daarna wat opgeluchter
gesteund door vriend",3,wat mij en iemand anders overkwam,1,,2,1,NA,5,4,2.084630508,1.414700871,3,3,4,4,1,2,2,4,4,1,4,4,4,2,1,4,4,4,4,4,4,6,6,5,6,6,7,1.14149975,0.980019119,0.55861097,0.932408372,1.391877796,1.113438722,1.087141367,0.627886187,1.262939687,1.285847635,1.31446663,18,2,,3,,1,,4,2.25,1.333333333,1.063285112,1.749665689,1,NA,1
209,R_3nP2V83TVa0OYoI,NL,2,Vorige week vrijdag. Ik was net thuis. De reden dat ik moest huilen is dat ik het gevoel had dat ik mijn tentamen had verpest. Mijn moeder kwam met me praten en me troosten en moed inspreken.,1,,2,,3,1,4,3,2,0.332559879,-0.02089899,5,20,5,5,2,4,5,5,5,5,5,5,5,2,1,5,4,4,4,4,4,7,7,5,5,3,7,1.14149975,0.980019119,0.55861097,0.932408372,1.391877796,1.731087344,1.663222259,0.627886187,0.596848136,-0.723336485,1.31446663,18,2,,3,,1,,5,4.25,2.333333333,0.928599098,0.155830444,1,1,1
210,R_3stz2Xg3OqkPqZ4,NL,3,"Door een slecht toetsresultaat, ik raakte er boos en gefrustreerd door en heel erg gestresst.",1,,2,,2,1,4,5,2,2.084630508,-0.02089899,3,10,4,1,2,4,4,4,2,5,3,4,3,1,2,2,4,4,4,4,4,6,5,6,6,5,7,1.14149975,0.980019119,0.55861097,0.932408372,1.391877796,1.113438722,0.511060475,1.261499957,1.262939687,0.616119595,1.31446663,18,2,,3,,1,,2.714285714,3.5,2.666666667,1.007631007,1.031865759,2,1,1
211,R_2qyLAh2JjV1AXlk,NL,2,"Was in het donker alleen aan het fietsen, en toen kwam er een jongen op een scooter naast mij fietsen en die begon allemaal dingen naar mij te roepen. En daardoor kreeg ik een angstig gevoel ik mijn buik en hij bleef maar naast mij rijden. Nadat hij weg was gegaan, belde ik mijn vriend op en moest ik huilen, omdat ik het een vervelende ervaring vond",1,,1,,3,1,4,3,1,0.332559879,-0.73869892,2,10,5,4,1,3,2,3,4,3,5,5,4,1,1,5,3,4,4,4,3,5,5,5,4,5,7,-0.251067568,0.980019119,0.55861097,0.932408372,0.3870703,0.4957901,0.511060475,0.627886187,-0.069243416,0.616119595,1.31446663,18,2,,3,,1,,4.571428571,2.25,1.666666667,0.554829161,-0.203069521,1,1,1
212,R_1E06bhAJ6W8v7mb,NL,2,"Aanleidng: extreem vervoeid zijn en het extreem druk hebben.
",1,,4,Stress/vermoeidheid,2,1,4,3,2,0.332559879,-0.02089899,3,2,4,2,3,4,2,4,2,3,2,4,3,2,2,3,4,4,4,4,3,6,6,5,6,4,6,1.14149975,0.980019119,0.55861097,0.932408372,0.3870703,1.113438722,1.087141367,0.627886187,1.262939687,-0.053608445,0.823754551,18,2,,3,,1,,2.857142857,2.75,3,0.805560053,0.155830444,1,1,1
213,R_2Vgu9pupSbwsCse,NL,2,"De aanleiding was angst door een vreemde man die me beetpakte. Ik voelde me heel angstig, en was in de Starbucks. Mijn vriend troostte me toen hij wat later kwam",1,,4,Angst,5,1,3,2,1,-0.543475436,-0.73869892,4,8,3,2,2,3,5,5,3,5,2,3,2,2,1,2,4,4,4,4,4,7,7,6,7,7,7,1.14149975,0.980019119,0.55861097,0.932408372,1.391877796,1.731087344,1.663222259,1.261499957,1.929031239,1.955575676,1.31446663,18,2,,3,,1,,2.428571429,4.25,2,1.350845374,-0.641087178,1,1,1
214,R_2Yncw2PZGy1N76t,EN-GB,5,,3,school,1,,3,1,4,3,3,0.332559879,0.69690094,5,1,3,4,4,2,5,5,4,3,2,2,4,4,3,2,3,3,4,4,3,7,7,6,7,7,7,-0.251067568,-0.347461324,0.55861097,0.932408372,0.3870703,1.731087344,1.663222259,1.261499957,1.929031239,1.955575676,1.31446663,19,2,,3,,5,Russia,3,4.25,3,1.012222169,0.514730409,2,1,1
215,R_3oRce97LAo07QHo,EN-GB,2,I was telling my boyfriend about not being sure of our relationship and I felt bad about it. We talked (at his house) and afterwards I felt a little better.,3,because of relationship difficulties,2,,2,1,4,2,2,-0.543475436,-0.02089899,3,7,3,4,2,1,4,5,4,5,2,2,4,4,1,3,4,3,3,3,3,6,6,6,6,6,6,1.14149975,-0.347461324,-1.311794299,-0.394937304,0.3870703,1.113438722,1.087141367,1.261499957,1.262939687,1.285847635,0.823754551,19,2,,3,,1,,3.142857143,4.5,1.333333333,0.573545368,-0.282187213,1,1,1
216,R_2wU0T895Iu4oJwf,NL,2,"De aanleiding was dat ik twijfelde over of ik mijn kamer wil houden die ik niet leuk vind, en daar veel over piekerde en daardoor spanning voelde. ik was thuis en ik voelde me ervoor heel gespannen en daarna iets minder. Ik werd door mijn ouders gesteund en getroost door er even over te praten.",1,,4,spanning,3,1,4,3,2,0.332559879,-0.02089899,3,5,4,2,2,5,3,3,4,2,5,3,4,2,2,4,3,4,4,3,2,6,5,5,5,5,6,-0.251067568,0.980019119,0.55861097,-0.394937304,-0.617737195,1.113438722,0.511060475,0.627886187,0.596848136,0.616119595,0.823754551,19,2,,3,,1,,3.714285714,2.5,3,0.414908699,0.155830444,1,1,1
217,R_2Vf3QzZnFRv6fTr,NL,2,"ruzie met mijn vriend, thuis",1,,1,,2,1,4,3,2,0.332559879,-0.02089899,3,7,4,3,2,3,4,5,2,4,3,4,5,4,2,4,4,3,4,3,3,6,6,5,5,5,6,1.14149975,-0.347461324,0.55861097,-0.394937304,0.3870703,1.113438722,1.087141367,0.627886187,0.596848136,0.616119595,0.823754551,19,2,,3,,1,,3.571428571,4.25,2.333333333,0.564542814,0.155830444,1,1,1
218,R_2XjOi0ENl2cvmlK,NL,4,De aanleiding tot de huilervaring was een emotioneel gesprek bij mij thuis. Ik voelde me niet erg prettig voor en na deze huilervaring. Daarom werd ik gesteund door een vriendin van me.,1,,1,,2,1,4,3,2,0.332559879,-0.02089899,6,1,4,3,2,2,5,2,3,4,4,4,5,3,2,3,4,4,4,4,4,5,4,3,4,3,4,1.14149975,0.980019119,0.55861097,0.932408372,1.391877796,0.4957901,-0.065020417,-0.639341352,-0.069243416,-0.723336485,-0.157669608,19,2,,3,,2,China,3.714285714,3.5,2,0.34959953,0.155830444,2,1,1
219,R_BtaMtE6uAPZm8z7,NL,4,"Ik had net te horen gekregen dat er bij ons thuis ingebroken was, en alle belangrijke sieraden van mijn moeders overleden zus gestolen waren. Nadat ik mijn moeder huilend aan de telefoon had gehad was ik daar zelf ook van slag van geraakt, en toen iemand me een knuffel gaf moest ik huilen. Ik werd dus wel getroost.",2,,1,,2,1,4,1,1,-1.41951075,-0.73869892,3,2,4,2,1,4,5,4,4,4,5,4,4,1,1,4,4,3,4,4,3,5,5,3,3,4,6,1.14149975,-0.347461324,0.55861097,0.932408372,0.3870703,0.4957901,0.511060475,-0.639341352,-0.735334967,-0.053608445,0.823754551,19,2,,3,,1,,3.857142857,3.5,2,0.279495312,-1.079104835,2,1,1
220,R_VVbd7wa4wHr8AYV,NL,3,,1,,4,angst,3,1,4,4,3,1.208595193,0.69690094,6,3,3,4,3,4,3,4,2,3,2,3,4,2,2,3,3,3,3,3,2,6,6,5,6,6,5,-0.251067568,-0.347461324,-1.311794299,-0.394937304,-0.617737195,1.113438722,1.087141367,0.627886187,1.262939687,1.285847635,0.333042471,19,2,,3,,1,,3,3,3,0.253390762,0.952748067,2,1,1
221,R_31Qri81g7Q2OvMx,NL,2,toen mijn moeder moest huilen door het overlijden van een vriendin de dag dat ze het hoorde,2,,1,,2,1,4,2,1,-0.543475436,-0.73869892,6,6,4,2,4,4,5,5,4,3,1,1,3,2,4,2,3,4,4,4,2,5,5,4,3,5,7,-0.251067568,0.980019119,0.55861097,0.932408372,-0.617737195,0.4957901,0.511060475,-0.005727582,-0.735334967,0.616119595,1.31446663,19,2,,3,,1,,2.428571429,3.75,4,0.345327995,-0.641087178,1,1,1
222,R_pK3dkex7FRfgGtz,NL,3,Ik moest huilen toen ik dacht aan mijn hond die mijn vader afgelopen maand heeft weggedaan.,1,,1,,2,3,4,1,2,-1.41951075,-0.02089899,5,5,3,4,4,3,5,5,2,5,2,3,4,5,3,3,4,4,4,4,2,7,6,6,7,6,7,1.14149975,0.980019119,0.55861097,0.932408372,-0.617737195,1.731087344,1.087141367,1.261499957,1.929031239,1.285847635,1.31446663,19,2,,3,,1,,3,5,3.333333333,1.054897744,-0.72020487,2,1,0
223,R_bI3uXDITvDjsEkV,NL,2,,1,,1,,2,1,2,3,2,0.332559879,-0.02089899,3,2,4,1,3,2,1,4,4,4,3,5,4,1,3,4,3,3,4,3,2,5,5,1,5,5,7,-0.251067568,-0.347461324,0.55861097,-0.394937304,-0.617737195,0.4957901,0.511060475,-1.906568891,0.596848136,0.616119595,1.31446663,19,2,,3,,1,,3.571428571,2.5,2.666666667,0.052283966,0.155830444,1,1,1
224,R_1LTmSi8Cm1SpP2g,NL,2,De aanleiding was buitengesloten worden door vriendinnen. Ik zat in de trein. Voor het huilen voelde ik erg verraden en na het huilen een stuk opgeluchter. Ik werd wel door iemand gesteund,1,,1,,4,1,4,1,1,-1.41951075,-0.73869892,3,1,4,3,2,2,2,2,3,2,4,4,4,1,1,4,3,4,4,3,3,6,6,5,5,6,6,-0.251067568,0.980019119,0.55861097,-0.394937304,0.3870703,1.113438722,1.087141367,0.627886187,0.596848136,1.285847635,0.823754551,19,2,,3,,1,,3.714285714,1.75,1.666666667,0.619510192,-1.079104835,1,1,1
225,R_yDVvLM5vbqzCssF,NL,2,"De aanleiding van mijn laatste huilervaring was stress. Ik had veel dingen die ik voor school moest doen, maar ik was het overzicht even kwijt. Op het moment van de huilervaring was ik thuis en werd ik gesteund door mijn moeder. Mijn moeder heeft mij geholpen om het allemaal weer even te relativeren, dus daarna voelde ik mij een stuk beter.",1,,2,,2,1,4,2,2,-0.543475436,-0.02089899,3,3,2,4,4,1,5,5,4,5,4,2,2,2,2,4,4,2,3,4,4,7,7,6,6,6,7,1.14149975,-1.674941768,-1.311794299,0.932408372,1.391877796,1.731087344,1.663222259,1.261499957,1.262939687,1.285847635,1.31446663,19,2,,3,,1,,3.142857143,4.25,2.333333333,0.818010306,-0.282187213,1,1,1
226,R_3EuOg8yRaq6mEb1,NL,2,De aanleiding van mijn laatste huilervaring was door een drukke periode op de universiteit. Ik had op dat moment veel stress. Tijdens het huilen was ik thuis en werd ik gesteund en getroost door mijn vriend.,1,,2,,2,1,4,4,3,1.208595193,0.69690094,3,10,4,4,3,4,4,4,2,4,3,2,4,3,2,3,4,3,4,3,3,5,6,5,5,5,6,1.14149975,-0.347461324,0.55861097,-0.394937304,0.3870703,0.4957901,1.087141367,0.627886187,0.596848136,0.616119595,0.823754551,19,2,,3,,1,,3.142857143,3.75,3,0.508392939,0.952748067,1,1,1
227,R_3Mg25CZN5dMIPcu,NL,2,Ik was verdrietig omdat het niet goed ging met mijn mama.,2,,1,,2,1,4,2,1,-0.543475436,-0.73869892,4,4,4,3,3,3,4,4,3,4,3,3,4,3,2,3,4,3,4,4,4,5,5,4,4,4,6,1.14149975,-0.347461324,0.55861097,0.932408372,1.391877796,0.4957901,0.511060475,-0.005727582,-0.069243416,-0.053608445,0.823754551,19,2,,3,,1,,3.285714286,3.75,2.666666667,0.488996477,-0.641087178,1,1,1
228,R_Wx7kwAO2aCyhPpL,NL,3,ik had ruzie met mijn vriend,1,,2,,2,3,4,2,2,-0.543475436,-0.02089899,5,2,2,1,1,2,1,1,2,1,1,2,2,1,1,2,4,4,4,4,4,5,5,4,4,5,6,1.14149975,0.980019119,0.55861097,0.932408372,1.391877796,0.4957901,0.511060475,-0.005727582,-0.069243416,0.616119595,0.823754551,19,2,,3,,10,duitsland,1.714285714,1,1.333333333,0.670560885,-0.282187213,2,1,0
229,R_2DNuMcxVUMUFJTT,NL,2,"Ik moest huilen doordat mijn vriend me vroeg naar hoe een gesprek met mijn vader was verlopen. Dit gesprek was echter niet erg prettig geweest en ik voelde me daar nog steeds naar over. door het weer naar boven halen van deze herinneringen moest ik huilen. Mijn vriend en ik zaten op dit moment in de auto. Ervoor voelde ik me nogal rot, erna voelde ik me nog steeds naar, maar wel meer opgelucht. Mijn vriend trooste me ook erg, dat was prettig",1,,2,,2,1,4,2,1,-0.543475436,-0.73869892,3,7,4,1,4,4,5,5,5,5,4,4,3,2,2,4,3,3,4,2,3,5,5,6,3,5,6,-0.251067568,-0.347461324,0.55861097,-1.722282979,0.3870703,0.4957901,0.511060475,1.261499957,-0.735334967,0.616119595,0.823754551,19,2,,3,,1,,3.571428571,4.25,3.333333333,0.145250828,-0.641087178,1,1,1
230,R_3qlJEM4Wns36Y7a,NL,2,Het kwam door een persoonlijk conflict met een familielid,1,,4,Radeloos,2,1,4,5,5,2.084630508,2.132500801,6,4,4,2,3,4,3,4,3,2,4,4,4,3,2,3,4,4,4,4,4,5,6,5,5,5,5,1.14149975,0.980019119,0.55861097,0.932408372,1.391877796,0.4957901,1.087141367,0.627886187,0.596848136,0.616119595,0.333042471,19,2,,3,,1,,3.428571429,3,3,0.796476715,2.108565654,1,1,1
231,R_9n4WCEiUEW2DyOl,NL,3,"De aanleiding was een combinatie van meerdere dingen, drukke schooldagen en een woordenwisseling met mijn vriend. Ervoor voelde ik me emotioneel onstabiel. Ik werd gesteund door mijn vriend waarna ik me een stuk beter voelde.",1,,2,,2,1,4,2,2,-0.543475436,-0.02089899,2,2,4,2,3,4,4,4,3,4,4,4,3,2,1,3,3,4,4,3,2,6,6,5,5,6,6,-0.251067568,0.980019119,0.55861097,-0.394937304,-0.617737195,1.113438722,1.087141367,0.627886187,0.596848136,1.285847635,0.823754551,19,2,,3,,1,,3.285714286,3.5,2.666666667,0.528164056,-0.282187213,2,1,1
232,R_ABt3kfYXpUD6rVD,NL,2,ik kreeg te horen dat de kanker van mijn bovenbuurman terug was en dat er geen kans op genezing is,2,,1,,5,1,4,4,5,1.208595193,2.132500801,7,2,2,4,4,4,5,4,2,5,4,4,4,3,2,2,4,4,4,4,4,7,7,7,7,6,7,1.14149975,0.980019119,0.55861097,0.932408372,1.391877796,1.731087344,1.663222259,1.895113727,1.929031239,1.285847635,1.31446663,19,2,,3,,1,,3.142857143,4.25,3.333333333,1.347562258,1.670547997,1,1,1
233,R_1dtq0xMNAeAxA15,NL,4,,2,,1,,3,1,4,2,2,-0.543475436,-0.02089899,3,3,4,4,3,2,1,4,3,4,4,3,4,4,2,3,4,3,3,3,2,5,5,3,3,6,7,1.14149975,-0.347461324,-1.311794299,-0.394937304,-0.617737195,0.4957901,0.511060475,-0.639341352,-0.735334967,1.285847635,1.31446663,19,2,,3,,1,,3.571428571,3.25,2.333333333,0.063823468,-0.282187213,2,1,1
234,R_1l6IiB9dLInrjbi,NL,4,"Mijn ouders waren geirriteerd en ik juist heel blij. Toen vond ik het niet leuk dat ze ""gemeen"". Maar: ik was net met de pil begonnen weer dus denk dat het voornamelijk aan de hormonen lag.",1,,1,,3,1,4,2,2,-0.543475436,-0.02089899,1,10,2,1,4,2,5,5,1,5,1,1,1,5,2,1,4,4,4,3,4,6,6,4,4,4,7,1.14149975,0.980019119,0.55861097,-0.394937304,1.391877796,1.113438722,1.087141367,-0.005727582,-0.069243416,-0.053608445,1.31446663,19,2,,3,,1,,1.142857143,5,2.666666667,0.642139782,-0.282187213,2,1,1
235,R_1mV3qtzYmwHUk2R,NL,3,Ik was heel druk en moest veel keuzes maken raakten daarvan een beetje in paniek. Ik kon praten met familie en vrienden. Dat bieden troost,1,,4,stress,3,1,4,2,1,-0.543475436,-0.73869892,5,1.5,3,2,2,3,2,2,2,3,4,3,4,2,2,3,3,4,4,4,3,5,5,5,5,5,6,-0.251067568,0.980019119,0.55861097,0.932408372,0.3870703,0.4957901,0.511060475,0.627886187,0.596848136,0.616119595,0.823754551,19,2,,3,,1,,3,2.25,2.333333333,0.570772749,-0.641087178,2,1,1
236,R_3lzPUSeoH3f69pL,NL,2,"Ik moest huilen in de auto van mijn vriend, omdat ik dacht aan de uitvaart van mijn oma, die de dag ervoor had plaatsgevonden. Mijn vriend was hierbij om me te steunen.",2,,1,,2,1,4,3,1,0.332559879,-0.73869892,5,10,4,4,3,4,4,4,4,4,3,2,4,2,3,3,4,4,4,4,3,7,7,6,6,6,6,1.14149975,0.980019119,0.55861097,0.932408372,0.3870703,1.731087344,1.663222259,1.261499957,1.262939687,1.285847635,0.823754551,19,2,,3,,1,,3.428571429,3.5,3.333333333,1.093450904,-0.203069521,1,1,1
237,R_1n6Yr3RnLMZWgHQ,NL,2,,1,,2,,3,1,2,3,2,0.332559879,-0.02089899,3,20,4,2,2,2,5,5,5,5,2,4,2,5,2,4,3,4,4,4,2,2,1,3,2,3,5,-0.251067568,0.980019119,0.55861097,0.932408372,-0.617737195,-1.357155765,-1.793263093,-0.639341352,-1.401426518,-0.723336485,0.333042471,19,2,,3,,1,,3.285714286,5,2,-0.361749731,0.155830444,1,1,1
238,R_231tVkfft7Lq0GQ,NL,4,"Het broertje van een studiegenoot had zelfmoord gepleegd. Ik hoorde dit van een andere studiegenoot en was samen met haar en een vriendin. Daarna voelde ik mij een paar dagen verdrietig. Ik ben gesteund door die vriendin, mijn zusje en mijn ouders.",2,,1,,3,1,4,4,5,1.208595193,2.132500801,5,0,4,4,2,3,3,4,4,5,5,4,5,2,1,4,4,4,4,4,4,7,7,6,6,6,7,1.14149975,0.980019119,0.55861097,0.932408372,1.391877796,1.731087344,1.663222259,1.261499957,1.262939687,1.285847635,1.31446663,20,2,,3,,1,,4.285714286,3.5,2,1.229407229,1.670547997,2,1,1
239,R_ZqtNzYb4Okunlst,NL,2,Ik was depressief. Mijn vriend reageert soms boos uit frustratie omdat hij niks kan doen. Ik was bij hem thuis. Van te voren voelde ik me down. Na het huilen en praten voelde ik me beter,3,"Beide, ik voelde me rot en ik wil dat gevoel niet doorgeven",1,,2,1,4,3,3,0.332559879,0.69690094,3,5,4,3,2,3,1,2,4,2,4,4,3,1,2,3,4,3,4,3,2,6,5,5,4,5,7,1.14149975,-0.347461324,0.55861097,-0.394937304,-0.617737195,1.113438722,0.511060475,0.627886187,-0.069243416,0.616119595,1.31446663,20,2,,3,,1,,3.571428571,1.5,2.333333333,0.404882099,0.514730409,1,1,1
240,R_21B4tt6MJ4Xc7u1,NL,2,"Ik moest huilen toen ik mijn vriend mijn gevoelens vertelde over het feit dat we elkaar weinig zien. Ik werd gelijk door hem gesteund. Het was iets waar ik mee rondliep, dus was het een opluchting om te vertellen en te huilen erbij.",1,,1,,2,1,2,1,1,-1.41951075,-0.73869892,2,3,4,4,2,4,5,4,3,3,4,4,5,2,2,4,4,4,4,4,3,5,6,5,5,5,6,1.14149975,0.980019119,0.55861097,0.932408372,0.3870703,0.4957901,1.087141367,0.627886187,0.596848136,0.616119595,0.823754551,20,2,,3,,1,,4,3.5,2.666666667,0.749740768,-1.079104835,1,1,1
241,R_SCSlVk1OCrFuhqh,NL,2,Het was vanwege stress en ik had iemand die mij steunde. Het voelde achteraf opgelucht,1,,4,Stress,2,1,2,1,2,-1.41951075,-0.02089899,3,2,4,2,2,2,3,3,2,4,4,4,2,4,2,3,3,3,4,4,2,6,6,5,4,3,6,-0.251067568,-0.347461324,0.55861097,0.932408372,-0.617737195,1.113438722,1.087141367,0.627886187,-0.069243416,-0.723336485,0.823754551,20,2,,3,,10,Tsjechië,3,3.5,2,0.284944926,-0.72020487,1,1,1
242,R_ZjUfjPxF5RtTyaR,NL,3,,1,,3,,5,1,4,3,1,0.332559879,-0.73869892,3,2,4,2,2,3,2,4,4,2,4,4,4,1,1,4,3,4,4,2,3,6,6,6,5,5,7,-0.251067568,0.980019119,0.55861097,-1.722282979,0.3870703,1.113438722,1.087141367,1.261499957,0.596848136,0.616119595,1.31446663,20,2,,3,,1,,3.714285714,2.25,2,0.540169477,-0.203069521,2,1,1
243,R_2VNNhs38sDkE0Tw,NL,2,"Ik voelde me verdrietig, maar weet niet precies waarom. Ik werd door mijn vriend getroost.",1,,1,,2,1,4,2,2,-0.543475436,-0.02089899,3,3,3,5,2,3,2,4,4,5,3,4,5,3,1,4,4,3,4,4,3,6,6,5,5,6,7,1.14149975,-0.347461324,0.55861097,0.932408372,0.3870703,1.113438722,1.087141367,0.627886187,0.596848136,1.285847635,1.31446663,20,2,,3,,1,,4,3.5,2,0.790705159,-0.282187213,1,1,1
244,R_25LLOjxN8g8kV5w,NL,3,"Ik was onzeker over mijn relatie, heb hier over gepraat met mijn vriend, en ik voelde me van te voren erg verdrietig, achteraf opgelucht.",1,,1,,2,1,4,5,3,2.084630508,0.69690094,2,3,3,2,2,3,1,2,4,2,4,4,4,1,1,4,4,3,4,3,3,3,4,5,4,4,6,1.14149975,-0.347461324,0.55861097,-0.394937304,0.3870703,-0.739507144,-0.065020417,0.627886187,-0.069243416,-0.053608445,0.823754551,20,2,,3,,1,,3.571428571,1.5,2,0.169913064,1.390765724,2,1,1
